<?xml version="1.0" encoding="UTF-8"?>
<universidade xmlns:xsi="http://www.w3.org/2001/XMLSchema-instance" xsi:noNamespaceSchemaLocation="universidade.xsd">
  <historia>
    A Universidade das Caxinas foi fundada em 2025 e representa a fusão entre tradição marítima e inovação académica.
  </historia>

  <cursos>
    <curso><nome>Artes Multimédia</nome><departamento>Artes</departamento><grau>Licenciatura</grau></curso>
    <curso><nome>Ciências da Comunicação</nome><departamento>Comunicação</departamento><grau>Licenciatura</grau></curso>
    <curso><nome>Informática</nome><departamento>Engenharia Informática</departamento><grau>Licenciatura</grau></curso>
    <curso><nome>Relações Públicas e Gestão de Comunicação</nome><departamento>Comunicação</departamento><grau>Licenciatura</grau></curso>
    <curso><nome>Tecnologias de Comunicação Multimédia</nome><departamento>Tecnologia</departamento><grau>Licenciatura</grau></curso>
    <curso><nome>Criminologia</nome><departamento>Ciências Sociais</departamento><grau>Licenciatura</grau></curso>
    <curso><nome>Psicologia</nome><departamento>Ciências Sociais</departamento><grau>Licenciatura</grau></curso>
    <curso><nome>Educação Física e Desporto</nome><departamento>Desporto</departamento><grau>Licenciatura</grau></curso>
    <curso><nome>Gestão de Desporto</nome><departamento>Desporto</departamento><grau>Licenciatura</grau></curso>
    <curso><nome>Energias Renováveis</nome><departamento>Engenharia</departamento><grau>Licenciatura</grau></curso>
    <curso><nome>Gestão de Empresas</nome><departamento>Gestão</departamento><grau>Licenciatura</grau></curso>
    <curso><nome>Gestão de Marketing</nome><departamento>Gestão</departamento><grau>Licenciatura</grau></curso>
    <curso><nome>Gestão de Recursos Humanos</nome><departamento>Gestão</departamento><grau>Licenciatura</grau></curso>
    <curso><nome>Turismo</nome><departamento>Turismo</departamento><grau>Licenciatura</grau></curso>
  </cursos>

  <inscricoes>
    <inscricao>
      <nome>Exemplo Teste</nome>
      <email>teste@caxinas.pt</email>
      <password>segredo123</password>
      <genero>Outro</genero>
      <grau_academico>12º ano</grau_academico>
      <licenciatura>Informática</licenciatura>
      <mensagem>Estou interessado em saber mais sobre alojamento e bolsas.</mensagem>
    </inscricao>
  </inscricoes>
</universidade>
